{
    "$schema": "./character-schema.json",
    "type": "sparrow",
    "atlas": "Mom_Assets",
    "animations": [
        {
            "name": "idle",
            "prefix": "Mom Idle",
            "frameRate": 24,
            "looped": false,
            "offsets": [0, 0]
        },
        {
            "name": "singUP",
            "prefix": "Mom Up Pose",
            "frameRate": 24,
            "looped": false,
            "offsets": [14, 71]
        },
        {
            "name": "singDOWN",
            "prefix": "MOM DOWN POSE",
            "frameRate": 24,
            "looped": false,
            "offsets": [20, -160]
        },
        {
            "name": "singLEFT",
            "prefix": "Mom Left Pose",
            "frameRate": 24,
            "looped": false,
            "offsets": [250, -23]
        },
        {
            "$comment": "ANIMATION IS CALLED MOM LEFT POSE BUT ITS FOR THE RIGHT CUZ DAVE IS DUMB!",
            "name": "singRIGHT",
            "prefix": "Mom Pose Left",
            "frameRate": 24,
            "looped": false,
            "offsets": [10, -60]
        }
    ],
    "startingAnimation": {
        "name": "idle"
    }
}